{
  "annotation_guide_sha256": "6ba373984446704f27969b83b2c0e7960839e32022d129758cb069e460289925",
  "annotation_guide_version": "decomposition-guide/1.1.0",
  "annotation_mode": "single_annotator",
  "annotator_id": "owner",
  "concept_catalog_id": "decomposition-catalog-dev-57dff640761ba61e",
  "concept_catalog_sha256": "57dff640761ba61e110c04f913d6473a95d94a233f8d0c77f38b5d7638d8d009",
  "gold_label": "single_annotator_reference_gold",
  "independence_attestation": {
    "model_outputs_not_viewed": true,
    "test_source_not_inspected": true
  },
  "issue_log_id": "decomposition-issue-log-dev-44f675ac70a1335a",
  "issue_log_sha256": "44f675ac70a1335a53df96e2f86512491967488084efd4834eb9761a8e112288",
  "items": [
    {
      "criterion_id": "nct02932007-exclusion-04393439bf6f2032",
      "criterion_type": "exclusion",
      "eligibility_sha256": "b4cf469ca0bd086b9706ec8a1c7ae8e26adb25ddeecefd97b19b586beeba6e10",
      "expression": null,
      "nct_id": "NCT02932007",
      "protocol_sha256": "9ab7e5ab649589927545e06dbc10b6dde12a75499ca2224696dd505643752ca5",
      "resolution_flags": [],
      "source_id": "clinicaltrials.gov:NCT02932007:eligibility:2019-08-19:b4cf469ca0bd",
      "source_record_version": "2019-08-19:b4cf469ca0bd",
      "source_span": {
        "end": 2801,
        "start": 2634
      },
      "source_text": "Serious or active medical or psychiatric condition which, in the opinion of the investigator, may interfere with treatment, assessment, or compliance with the protocol"
    },
    {
      "criterion_id": "nct02932007-inclusion-3449060b23561f00",
      "criterion_type": "inclusion",
      "eligibility_sha256": "b4cf469ca0bd086b9706ec8a1c7ae8e26adb25ddeecefd97b19b586beeba6e10",
      "expression": null,
      "nct_id": "NCT02932007",
      "protocol_sha256": "9ab7e5ab649589927545e06dbc10b6dde12a75499ca2224696dd505643752ca5",
      "resolution_flags": [],
      "source_id": "clinicaltrials.gov:NCT02932007:eligibility:2019-08-19:b4cf469ca0bd",
      "source_record_version": "2019-08-19:b4cf469ca0bd",
      "source_span": {
        "end": 580,
        "start": 376
      },
      "source_text": "AF must be documented at least once either by ECG, event monitoring, loop recorder, telemetry, trans-telephonic monitoring, pacemaker or cardiac defibrillator readouts within 24 months prior to enrollment"
    },
    {
      "criterion_id": "nct02932007-inclusion-9fa662d9d6bd53f7",
      "criterion_type": "inclusion",
      "eligibility_sha256": "b4cf469ca0bd086b9706ec8a1c7ae8e26adb25ddeecefd97b19b586beeba6e10",
      "expression": null,
      "nct_id": "NCT02932007",
      "protocol_sha256": "9ab7e5ab649589927545e06dbc10b6dde12a75499ca2224696dd505643752ca5",
      "resolution_flags": [],
      "source_id": "clinicaltrials.gov:NCT02932007:eligibility:2019-08-19:b4cf469ca0bd",
      "source_record_version": "2019-08-19:b4cf469ca0bd",
      "source_span": {
        "end": 372,
        "start": 50
      },
      "source_text": "History of symptomatic persistent AF Persistent AF - defined as continuous AF that is sustained more than 7 days but less than 12 months. Episodes of AF of ≥ 48 hours duration in which a decision is made to terminate with electrical or pharmacological cardioversion prior to 7 days will also be classified as persistent AF"
    },
    {
      "criterion_id": "nct02932007-inclusion-a87b29150a5fc629",
      "criterion_type": "inclusion",
      "eligibility_sha256": "b4cf469ca0bd086b9706ec8a1c7ae8e26adb25ddeecefd97b19b586beeba6e10",
      "expression": null,
      "nct_id": "NCT02932007",
      "protocol_sha256": "9ab7e5ab649589927545e06dbc10b6dde12a75499ca2224696dd505643752ca5",
      "resolution_flags": [],
      "source_id": "clinicaltrials.gov:NCT02932007:eligibility:2019-08-19:b4cf469ca0bd",
      "source_record_version": "2019-08-19:b4cf469ca0bd",
      "source_span": {
        "end": 740,
        "start": 584
      },
      "source_text": "Currently on anticoagulation therapy as indicated per local guidelines, which is considered optimal for stroke prevention in the opinion of the investigator"
    },
    {
      "criterion_id": "nct02932007-inclusion-ce4fe9d7f97194cb",
      "criterion_type": "inclusion",
      "eligibility_sha256": "b4cf469ca0bd086b9706ec8a1c7ae8e26adb25ddeecefd97b19b586beeba6e10",
      "expression": null,
      "nct_id": "NCT02932007",
      "protocol_sha256": "9ab7e5ab649589927545e06dbc10b6dde12a75499ca2224696dd505643752ca5",
      "resolution_flags": [],
      "source_id": "clinicaltrials.gov:NCT02932007:eligibility:2019-08-19:b4cf469ca0bd",
      "source_record_version": "2019-08-19:b4cf469ca0bd",
      "source_span": {
        "end": 943,
        "start": 744
      },
      "source_text": "Implanted dual chamber pacemaker/ICD capable of monitoring atrial arrhythmias or willingness to wear a 2 weeks event monitor if patient does not have a device capable of monitoring atrial arrhythmias"
    },
    {
      "criterion_id": "nct05136131-exclusion-2f16526f17fb2859",
      "criterion_type": "exclusion",
      "eligibility_sha256": "42a8201cb6a7c38bd57fc5e82323b7e34c488f544ca55978ab5cb9c2bd74301a",
      "expression": null,
      "nct_id": "NCT05136131",
      "protocol_sha256": "56f2a93e95b2c45d94d0682bd5b56242e525fb59a2c630ba7a85440b608c7e7f",
      "resolution_flags": [],
      "source_id": "clinicaltrials.gov:NCT05136131:eligibility:2026-07-01:42a8201cb6a7",
      "source_record_version": "2026-07-01:42a8201cb6a7",
      "source_span": {
        "end": 794,
        "start": 698
      },
      "source_text": "Patients for whom the investigator believes that the trial is not in the interest of the patient"
    },
    {
      "criterion_id": "nct05860894-inclusion-83b4b84c3a0bc30e",
      "criterion_type": "inclusion",
      "eligibility_sha256": "a338254941c90c284c465491e5d60606208e355e0e1670cfc8aaaa1319dd9a7c",
      "expression": null,
      "nct_id": "NCT05860894",
      "protocol_sha256": "41d8fa5387eaf29f0b2d20e9dc5b3f0b8dd5bb032da19ab2eba0361d1a236b41",
      "resolution_flags": [],
      "source_id": "clinicaltrials.gov:NCT05860894:eligibility:2024-02-01:a338254941c9",
      "source_record_version": "2024-02-01:a338254941c9",
      "source_span": {
        "end": 410,
        "start": 386
      },
      "source_text": "Written informed consent"
    },
    {
      "criterion_id": "nct05860894-inclusion-93f9b176abd4e08d",
      "criterion_type": "inclusion",
      "eligibility_sha256": "a338254941c90c284c465491e5d60606208e355e0e1670cfc8aaaa1319dd9a7c",
      "expression": null,
      "nct_id": "NCT05860894",
      "protocol_sha256": "41d8fa5387eaf29f0b2d20e9dc5b3f0b8dd5bb032da19ab2eba0361d1a236b41",
      "resolution_flags": [],
      "source_id": "clinicaltrials.gov:NCT05860894:eligibility:2024-02-01:a338254941c9",
      "source_record_version": "2024-02-01:a338254941c9",
      "source_span": {
        "end": 37,
        "start": 23
      },
      "source_text": "Age \\>18 years"
    },
    {
      "criterion_id": "nct06007872-exclusion-8a27abac4e0b299a",
      "criterion_type": "exclusion",
      "eligibility_sha256": "1e861dba3047f5bfaf43b237aab9bd304e6b49c6949c8b531edb63bf29e34c09",
      "expression": null,
      "nct_id": "NCT06007872",
      "protocol_sha256": "bddc80768ce96c2849e35bc3d670229150dbcdbeb5070405fbc10b427c590df0",
      "resolution_flags": [],
      "source_id": "clinicaltrials.gov:NCT06007872:eligibility:2025-10-21:1e861dba3047",
      "source_record_version": "2025-10-21:1e861dba3047",
      "source_span": {
        "end": 448,
        "start": 341
      },
      "source_text": "Patients with prior incomplete surgical or percutaneous left atrial appendage ligation/exclusion procedures"
    },
    {
      "criterion_id": "nct06007872-inclusion-e280adfc0698a565",
      "criterion_type": "inclusion",
      "eligibility_sha256": "1e861dba3047f5bfaf43b237aab9bd304e6b49c6949c8b531edb63bf29e34c09",
      "expression": null,
      "nct_id": "NCT06007872",
      "protocol_sha256": "bddc80768ce96c2849e35bc3d670229150dbcdbeb5070405fbc10b427c590df0",
      "resolution_flags": [],
      "source_id": "clinicaltrials.gov:NCT06007872:eligibility:2025-10-21:1e861dba3047",
      "source_record_version": "2025-10-21:1e861dba3047",
      "source_span": {
        "end": 171,
        "start": 23
      },
      "source_text": "All patients who meet guideline established criteria for commercially available Watchman device implant and not enrolled in an active clinical trial"
    },
    {
      "criterion_id": "nct06324188-exclusion-8b80b7c07f28b121",
      "criterion_type": "exclusion",
      "eligibility_sha256": "780d5af5b1990db947f80c85120d38e785a0868edde03fd9c0b7e1f0a9042112",
      "expression": null,
      "nct_id": "NCT06324188",
      "protocol_sha256": "ef2f5a3ebc879f7e9735858915315530ae329ad0426a7855f42e1a221bb61236",
      "resolution_flags": [],
      "source_id": "clinicaltrials.gov:NCT06324188:eligibility:2026-01-08:780d5af5b199",
      "source_record_version": "2026-01-08:780d5af5b199",
      "source_span": {
        "end": 1126,
        "start": 1080
      },
      "source_text": "E10. Valve disease requiring specific therapy."
    },
    {
      "criterion_id": "nct06324188-exclusion-cb02dc28e5f24a5b",
      "criterion_type": "exclusion",
      "eligibility_sha256": "780d5af5b1990db947f80c85120d38e785a0868edde03fd9c0b7e1f0a9042112",
      "expression": null,
      "nct_id": "NCT06324188",
      "protocol_sha256": "ef2f5a3ebc879f7e9735858915315530ae329ad0426a7855f42e1a221bb61236",
      "resolution_flags": [],
      "source_id": "clinicaltrials.gov:NCT06324188:eligibility:2026-01-08:780d5af5b199",
      "source_record_version": "2026-01-08:780d5af5b199",
      "source_span": {
        "end": 692,
        "start": 505
      },
      "source_text": "E2. Participation in another clinical trial, either within the 3 months prior to enrolment or still on-going (participation in potential sub-studies connected to this trial is permitted)."